{
  "name": "message",
  "type": "component",
  "title": "Message",
  "description": "A complete chat message row with optional avatar, metadata, attachments, and footer content.",
  "stability": "stable",
  "dependencies": [
    "tokens",
    "theme",
    "avatar",
    "bubble",
    "attachment"
  ],
  "files": [
    "Sources/NativeCN/Components/Chat/CNChat.swift"
  ],
  "previewFiles": [
    "Sources/NativeCN/Components/Chat/CNChat+Previews.swift"
  ],
  "docs": [
    "Docs/Components/Chat.md"
  ],
  "copyPaste": {
    "destination": "AppUI/NativeCN/Components/Chat"
  }
}

