{
  "name": "attachment",
  "type": "component",
  "title": "Attachment",
  "description": "Attachment metadata and a tokenized attachment row for chat bubbles.",
  "stability": "stable",
  "dependencies": [
    "tokens",
    "theme",
    "primitives"
  ],
  "files": [
    "Sources/NativeCN/Components/Chat/CNChat.swift"
  ],
  "previewFiles": [
    "Sources/NativeCN/Components/Chat/CNChat+Previews.swift"
  ],
  "docs": [
    "Docs/Components/Chat.md"
  ],
  "copyPaste": {
    "destination": "AppUI/NativeCN/Components/Chat"
  }
}

